[
  {
    "request_id": "SYN-REQ-2026-00002",
    "observation_status": "confirmed_available",
    "last_checked_at": "2026-09-09T21:10:09.752688+00:00",
    "verifier_agent_id": "verifier-simulator-v1",
    "verified_removed_at": null,
    "reupload_detected_at": null,
    "notes": "Content verified active."
  },
  {
    "request_id": "SYN-REQ-2026-00003",
    "observation_status": "confirmed_available",
    "last_checked_at": "2026-09-15T01:22:18.446133+00:00",
    "verifier_agent_id": "verifier-simulator-v1",
    "verified_removed_at": null,
    "reupload_detected_at": null,
    "notes": "Content verified active."
  },
  {
    "request_id": "SYN-REQ-2026-00004",
    "observation_status": "confirmed_available",
    "last_checked_at": "2026-09-05T06:45:09.166529+00:00",
    "verifier_agent_id": "verifier-simulator-v1",
    "verified_removed_at": null,
    "reupload_detected_at": null,
    "notes": "Content verified active."
  },
  {
    "request_id": "SYN-REQ-2026-00006",
    "observation_status": "confirmed_removed",
    "last_checked_at": "2026-09-29T12:35:49.890505+00:00",
    "verifier_agent_id": "verifier-simulator-v1",
    "verified_removed_at": "2026-09-28T16:44:41.788764+00:00",
    "reupload_detected_at": null,
    "notes": "HTTP 404/410 content disabled confirmed."
  },
  {
    "request_id": "SYN-REQ-2026-00007",
    "observation_status": "confirmed_removed",
    "last_checked_at": "2026-09-26T03:47:53.008688+00:00",
    "verifier_agent_id": "verifier-simulator-v1",
    "verified_removed_at": "2026-09-24T19:34:04.760771+00:00",
    "reupload_detected_at": null,
    "notes": "HTTP 404/410 content disabled confirmed."
  },
  {
    "request_id": "SYN-REQ-2026-00008",
    "observation_status": "confirmed_removed",
    "last_checked_at": "2026-09-04T23:02:20.898987+00:00",
    "verifier_agent_id": "verifier-simulator-v1",
    "verified_removed_at": "2026-09-04T09:26:58.447209+00:00",
    "reupload_detected_at": null,
    "notes": "HTTP 404/410 content disabled confirmed."
  },
  {
    "request_id": "SYN-REQ-2026-00009",
    "observation_status": "confirmed_removed",
    "last_checked_at": "2026-09-29T14:05:20.303678+00:00",
    "verifier_agent_id": "verifier-simulator-v1",
    "verified_removed_at": "2026-09-29T10:34:56.784530+00:00",
    "reupload_detected_at": null,
    "notes": "HTTP 404/410 content disabled confirmed."
  },
  {
    "request_id": "SYN-REQ-2026-00010",
    "observation_status": "confirmed_removed",
    "last_checked_at": "2026-09-28T03:27:42.423466+00:00",
    "verifier_agent_id": "verifier-simulator-v1",
    "verified_removed_at": "2026-09-26T14:45:29.102696+00:00",
    "reupload_detected_at": null,
    "notes": "HTTP 404/410 content disabled confirmed."
  },
  {
    "request_id": "SYN-REQ-2026-00011",
    "observation_status": "confirmed_removed",
    "last_checked_at": "2026-09-16T23:51:58.508405+00:00",
    "verifier_agent_id": "verifier-simulator-v1",
    "verified_removed_at": "2026-09-16T21:51:58.508405+00:00",
    "reupload_detected_at": null,
    "notes": "HTTP 404/410 content disabled confirmed."
  },
  {
    "request_id": "SYN-REQ-2026-00012",
    "observation_status": "confirmed_removed",
    "last_checked_at": "2026-09-29T04:24:20.731075+00:00",
    "verifier_agent_id": "verifier-simulator-v1",
    "verified_removed_at": "2026-09-27T08:42:17.829666+00:00",
    "reupload_detected_at": null,
    "notes": "HTTP 404/410 content disabled confirmed."
  },
  {
    "request_id": "SYN-REQ-2026-00013",
    "observation_status": "confirmed_removed",
    "last_checked_at": "2026-09-07T13:11:47.830917+00:00",
    "verifier_agent_id": "verifier-simulator-v1",
    "verified_removed_at": "2026-09-07T00:19:07.380629+00:00",
    "reupload_detected_at": null,
    "notes": "HTTP 404/410 content disabled confirmed."
  },
  {
    "request_id": "SYN-REQ-2026-00014",
    "observation_status": "confirmed_removed",
    "last_checked_at": "2026-09-13T08:38:30.949776+00:00",
    "verifier_agent_id": "verifier-simulator-v1",
    "verified_removed_at": "2026-09-13T06:38:30.949776+00:00",
    "reupload_detected_at": null,
    "notes": "HTTP 404/410 content disabled confirmed."
  },
  {
    "request_id": "SYN-REQ-2026-00019",
    "observation_status": "confirmed_available",
    "last_checked_at": "2026-09-06T06:26:33.722278+00:00",
    "verifier_agent_id": "verifier-simulator-v1",
    "verified_removed_at": null,
    "reupload_detected_at": null,
    "notes": "Content verified active."
  },
  {
    "request_id": "SYN-REQ-2026-00020",
    "observation_status": "confirmed_available",
    "last_checked_at": "2026-09-18T22:59:10.410136+00:00",
    "verifier_agent_id": "verifier-simulator-v1",
    "verified_removed_at": null,
    "reupload_detected_at": null,
    "notes": "Contradictory observation: HTTP 200 payload still accessible."
  },
  {
    "request_id": "SYN-REQ-2026-00023",
    "observation_status": "confirmed_removed",
    "last_checked_at": "2026-09-05T12:37:16.251380+00:00",
    "verifier_agent_id": "verifier-simulator-v1",
    "verified_removed_at": "2026-09-05T07:20:01.282653+00:00",
    "reupload_detected_at": null,
    "notes": "HTTP 404/410 content disabled confirmed."
  },
  {
    "request_id": "SYN-REQ-2026-00024",
    "observation_status": "confirmed_removed",
    "last_checked_at": "2026-09-08T16:03:17.481604+00:00",
    "verifier_agent_id": "verifier-simulator-v1",
    "verified_removed_at": "2026-09-08T09:51:01.744073+00:00",
    "reupload_detected_at": null,
    "notes": "HTTP 404/410 content disabled confirmed."
  },
  {
    "request_id": "SYN-REQ-2026-00025",
    "observation_status": "confirmed_removed",
    "last_checked_at": "2026-09-30T14:10:22.045008+00:00",
    "verifier_agent_id": "verifier-simulator-v1",
    "verified_removed_at": "2026-09-28T15:09:06.953794+00:00",
    "reupload_detected_at": null,
    "notes": "HTTP 404/410 content disabled confirmed."
  },
  {
    "request_id": "SYN-REQ-2026-00026",
    "observation_status": "confirmed_available",
    "last_checked_at": "2026-09-25T21:42:56.948895+00:00",
    "verifier_agent_id": "verifier-simulator-v1",
    "verified_removed_at": null,
    "reupload_detected_at": null,
    "notes": "Contradictory observation: HTTP 200 payload still accessible."
  },
  {
    "request_id": "SYN-REQ-2026-00027",
    "observation_status": "confirmed_removed",
    "last_checked_at": "2026-09-16T16:48:31.468760+00:00",
    "verifier_agent_id": "verifier-simulator-v1",
    "verified_removed_at": "2026-09-14T20:05:49.567860+00:00",
    "reupload_detected_at": null,
    "notes": "HTTP 404/410 content disabled confirmed."
  },
  {
    "request_id": "SYN-REQ-2026-00030",
    "observation_status": "confirmed_removed",
    "last_checked_at": "2026-09-16T20:53:39.759480+00:00",
    "verifier_agent_id": "verifier-simulator-v1",
    "verified_removed_at": "2026-09-16T03:03:34.556593+00:00",
    "reupload_detected_at": null,
    "notes": "HTTP 404/410 content disabled confirmed."
  },
  {
    "request_id": "SYN-REQ-2026-00031",
    "observation_status": "confirmed_removed",
    "last_checked_at": "2026-09-18T07:30:08.425842+00:00",
    "verifier_agent_id": "verifier-simulator-v1",
    "verified_removed_at": "2026-09-16T19:43:43.777341+00:00",
    "reupload_detected_at": null,
    "notes": "HTTP 404/410 content disabled confirmed."
  },
  {
    "request_id": "SYN-REQ-2026-00032",
    "observation_status": "confirmed_removed",
    "last_checked_at": "2026-09-17T23:00:55.234221+00:00",
    "verifier_agent_id": "verifier-simulator-v1",
    "verified_removed_at": "2026-09-17T08:44:30.173035+00:00",
    "reupload_detected_at": null,
    "notes": "HTTP 404/410 content disabled confirmed."
  },
  {
    "request_id": "SYN-REQ-2026-00033",
    "observation_status": "confirmed_removed",
    "last_checked_at": "2026-09-24T16:33:48.046813+00:00",
    "verifier_agent_id": "verifier-simulator-v1",
    "verified_removed_at": "2026-09-23T18:28:33.727038+00:00",
    "reupload_detected_at": null,
    "notes": "HTTP 404/410 content disabled confirmed."
  },
  {
    "request_id": "SYN-REQ-2026-00035",
    "observation_status": "confirmed_removed",
    "last_checked_at": "2026-09-27T06:36:27.917033+00:00",
    "verifier_agent_id": "verifier-simulator-v1",
    "verified_removed_at": "2026-09-25T15:47:59.115909+00:00",
    "reupload_detected_at": null,
    "notes": "HTTP 404/410 content disabled confirmed."
  },
  {
    "request_id": "SYN-REQ-2026-00037",
    "observation_status": "confirmed_removed",
    "last_checked_at": "2026-09-06T15:25:40.123980+00:00",
    "verifier_agent_id": "verifier-simulator-v1",
    "verified_removed_at": "2026-09-04T23:51:57.939018+00:00",
    "reupload_detected_at": null,
    "notes": "HTTP 404/410 content disabled confirmed."
  },
  {
    "request_id": "SYN-REQ-2026-00038",
    "observation_status": "confirmed_removed",
    "last_checked_at": "2026-09-17T07:04:00.261874+00:00",
    "verifier_agent_id": "verifier-simulator-v1",
    "verified_removed_at": "2026-09-16T04:50:53.885971+00:00",
    "reupload_detected_at": null,
    "notes": "HTTP 404/410 content disabled confirmed."
  },
  {
    "request_id": "SYN-REQ-2026-00041",
    "observation_status": "confirmed_removed",
    "last_checked_at": "2026-09-02T23:27:33.101934+00:00",
    "verifier_agent_id": "verifier-simulator-v1",
    "verified_removed_at": "2026-09-01T23:52:41.411044+00:00",
    "reupload_detected_at": null,
    "notes": "HTTP 404/410 content disabled confirmed."
  },
  {
    "request_id": "SYN-REQ-2026-00042",
    "observation_status": "confirmed_removed",
    "last_checked_at": "2026-09-13T00:43:54.155722+00:00",
    "verifier_agent_id": "verifier-simulator-v1",
    "verified_removed_at": "2026-09-12T22:43:54.155722+00:00",
    "reupload_detected_at": null,
    "notes": "HTTP 404/410 content disabled confirmed."
  },
  {
    "request_id": "SYN-REQ-2026-00043",
    "observation_status": "confirmed_available",
    "last_checked_at": "2026-09-21T04:50:55.171098+00:00",